,Date,ID,Username,Tweets,case folding,data cleaning,tokenisasi,normalisasi,stopwords,stemming
3375,11/23/2021 2:23,1.46297e+18,Dear Jamal (Taylor's Version),b'Baru permendikbud ppks aja laporannya langsung segunung.. gimana kalo ruupks disahin.. Apa ga kebelah ni negara sam\xe2\x80\xa6 https://t.co/TSbl6vgQjg',b'baru permendikbud ppks aja laporannya langsung segunung.. gimana kalo ruupks disahin.. apa ga kebelah ni negara sam\xe2\x80\xa6 https://t.co/tsbl6vgqjg',baru permendikbud ppks aja laporannya langsung segunung gimana kalo ruupks disahin apa ga kebelah ni negara sam,"['baru', 'permendikbud', 'ppks', 'aja', 'laporannya', 'langsung', 'segunung', 'gimana', 'kalo', 'ruupks', 'disahin', 'apa', 'ga', 'kebelah', 'ni', 'negara', 'sam']","['baru', 'permendukbidristek', 'ppks', 'aja', 'laporannya', 'langsung', 'segunung', 'gimana', 'kalo', 'ruupks', 'disahin', 'apa', 'ga', 'kebelah', 'ni', 'negara', 'sam']",permendukbidristek ppks aja laporannya langsung segunung gimana kalo ruupks disahin ga kebelah ni negara sam,"['permendukbidristek', 'ppks', 'aja', 'lapor', 'langsung', 'gunung', 'gimana', 'kalo', 'ruupks', 'disahin', 'ga', 'belah', 'ni', 'negara', 'sam']"
2878,11/23/2021 4:37,1.463e+18,Dita,"b'@bertanyarl Menurut aku itu berarti permendikbud  ppks bener"" memberikan dampak baik, karna korban"" yang sebelumnya\xe2\x80\xa6 https://t.co/kzpZuu1ssA'","b'@bertanyarl menurut aku itu berarti permendikbud  ppks bener"" memberikan dampak baik, karna korban"" yang sebelumnya\xe2\x80\xa6 https://t.co/kzpzuu1ssa'",menurut aku itu berarti permendikbud ppks bener memberikan dampak baik karna korban yang sebelumnya,"['menurut', 'aku', 'itu', 'berarti', 'permendikbud', 'ppks', 'bener', 'memberikan', 'dampak', 'baik', 'karna', 'korban', 'yang', 'sebelumnya']","['menurut', 'aku', 'itu', 'berarti', 'permendukbidristek', 'ppks', 'bener', 'memberikan', 'dampak', 'baik', 'karna', 'korban', 'yang', 'sebelumnya']",permendukbidristek ppks bener dampak karna korban,"['permendukbidristek', 'ppks', 'bener', 'dampak', 'karna', 'korban']"
5370,11/21/2021 15:24,1.46244e+18,Dwi Firli Ashari,"b'RT @CharlenneKayla: Permen PPKS dibawa media jadi ribut-ribut elit banget, deh. Kayaknya pada lupa wawancara kelompok paling penting dalam\xe2\x80\xa6'","b'rt @charlennekayla: permen ppks dibawa media jadi ribut-ribut elit banget, deh. kayaknya pada lupa wawancara kelompok paling penting dalam\xe2\x80\xa6'",permen ppks dibawa media jadi ribut ribut elit banget deh kayaknya pada lupa wawancara kelompok paling penting dalam,"['permen', 'ppks', 'dibawa', 'media', 'jadi', 'ribut', 'ribut', 'elit', 'banget', 'deh', 'kayaknya', 'pada', 'lupa', 'wawancara', 'kelompok', 'paling', 'penting', 'dalam']","['permendukbidristek', 'ppks', 'dibawa', 'media', 'jadi', 'ribut', 'ribut', 'elit', 'banget', 'deh', 'kayaknya', 'pada', 'lupa', 'wawancara', 'kelompok', 'paling', 'penting', 'dalam']",permendukbidristek ppks dibawa media ribut ribut elit banget deh kayaknya lupa wawancara kelompok,"['permendukbidristek', 'ppks', 'bawa', 'media', 'ribut', 'ribut', 'elit', 'banget', 'deh', 'kayak', 'lupa', 'wawancara', 'kelompok']"
5288,11/22/2021 6:27,1.46267e+18,Leon Kastayudha,b'Apa kemungkinan Permendikbud PPKS dicabut? Aplg ini politis selain serang Presiden jg sasar kursi kemendikbud. Sy b\xe2\x80\xa6 https://t.co/NP7sfbB7cM',b'apa kemungkinan permendikbud ppks dicabut? aplg ini politis selain serang presiden jg sasar kursi kemendikbud. sy b\xe2\x80\xa6 https://t.co/np7sfbb7cm',apa kemungkinan permendikbud ppks dicabut aplg ini politis selain serang presiden jg sasar kursi kemendikbud sy,"['apa', 'kemungkinan', 'permendikbud', 'ppks', 'dicabut', 'aplg', 'ini', 'politis', 'selain', 'serang', 'presiden', 'jg', 'sasar', 'kursi', 'kemendikbud', 'sy']","['apa', 'kemungkinan', 'permendukbidristek', 'ppks', 'dicabut', 'aplg', 'ini', 'politis', 'selain', 'serang', 'presiden', 'jg', 'sasar', 'kursi', 'kemendikbud', 'sy']",permendukbidristek ppks dicabut aplg politis serang presiden jg sasar kursi kemendikbud sy,"['permendukbidristek', 'ppks', 'cabut', 'aplg', 'politis', 'serang', 'presiden', 'jg', 'sasar', 'kursi', 'kemendikbud', 'sy']"
843,11/26/2021 6:00,1.46411e+18,bipol.co,b'Permendikbud PPKS Harus Dicabut dan Tolak RUU\xc2\xa0TPKS https://t.co/932QznyVQa',b'permendikbud ppks harus dicabut dan tolak ruu\xc2\xa0tpks https://t.co/932qznyvqa',permendikbud ppks harus dicabut dan tolak ruu xc tpks,"['permendikbud', 'ppks', 'harus', 'dicabut', 'dan', 'tolak', 'ruu', 'xc', 'tpks']","['permendukbidristek', 'ppks', 'harus', 'dicabut', 'dan', 'tolak', 'ruu', 'xc', 'tpks']",permendukbidristek ppks dicabut tolak ruu tpks,"['permendukbidristek', 'ppks', 'cabut', 'tolak', 'ruu', 'tpks']"
5395,11/21/2021 3:53,1.46227e+18,radaraktualdotcom,"b'Permendikbud PPKS Dirilis, Laporan Kekerasan Seksual Kampus\xc2\xa0Bermunculan https://t.co/tXTe2sXK08'","b'permendikbud ppks dirilis, laporan kekerasan seksual kampus\xc2\xa0bermunculan https://t.co/txte2sxk08'",permendikbud ppks dirilis laporan kekerasan seksual kampus xc bermunculan,"['permendikbud', 'ppks', 'dirilis', 'laporan', 'kekerasan', 'seksual', 'kampus', 'xc', 'bermunculan']","['permendukbidristek', 'ppks', 'dirilis', 'laporan', 'kekerasan', 'seksual', 'kampus', 'xc', 'bermunculan']",permendukbidristek ppks dirilis laporan kekerasan seksual kampus bermunculan,"['permendukbidristek', 'ppks', 'rilis', 'lapor', 'keras', 'seksual', 'kampus', 'muncul']"
4681,11/22/2021 14:47,1.46279e+18,MrFrost 🎙️📺 podcast,b'Permendikbud PPKS dirilis:\n\nSeks bebas makin menggila \xe2\x9c\x96\xef\xb8\x8f\xe2\x9c\x96\xef\xb8\x8f\xe2\x9c\x96\xef\xb8\x8f\nLaporan kekerasan seksual meningkat \xe2\x9c\x94\xef\xb8\x8f\xe2\x9c\x94\xef\xb8\x8f\xe2\x9c\x94\xef\xb8\x8f\n\nPredator k\xe2\x80\xa6 https://t.co/fnrvluYqGG',b'permendikbud ppks dirilis:\n\nseks bebas makin menggila \xe2\x9c\x96\xef\xb8\x8f\xe2\x9c\x96\xef\xb8\x8f\xe2\x9c\x96\xef\xb8\x8f\nlaporan kekerasan seksual meningkat \xe2\x9c\x94\xef\xb8\x8f\xe2\x9c\x94\xef\xb8\x8f\xe2\x9c\x94\xef\xb8\x8f\n\npredator k\xe2\x80\xa6 https://t.co/fnrvluyqgg',permendikbud ppks dirilis nseks bebas makin menggila xef xb xef xb xef xb nlaporan kekerasan seksual meningkat xef xb xef xb xef xb npredator,"['permendikbud', 'ppks', 'dirilis', 'nseks', 'bebas', 'makin', 'menggila', 'xef', 'xb', 'xef', 'xb', 'xef', 'xb', 'nlaporan', 'kekerasan', 'seksual', 'meningkat', 'xef', 'xb', 'xef', 'xb', 'xef', 'xb', 'npredator']","['permendukbidristek', 'ppks', 'dirilis', 'nseks', 'bebas', 'makin', 'menggila', 'xef', 'xb', 'xef', 'xb', 'xef', 'xb', 'nlaporan', 'kekerasan', 'seksual', 'meningkat', 'xef', 'xb', 'xef', 'xb', 'xef', 'xb', 'npredator']",permendukbidristek ppks dirilis nseks bebas menggila nlaporan kekerasan seksual meningkat npredator,"['permendukbidristek', 'ppks', 'rilis', 'nseks', 'bebas', 'gila', 'nlaporan', 'keras', 'seksual', 'tingkat', 'npredator']"
3289,11/23/2021 2:47,1.46298e+18,Ade Hendy PS,b'RT @FriendlyFrost: Permendikbud PPKS dirilis:\n\nSeks bebas makin menggila \xe2\x9c\x96\xef\xb8\x8f\xe2\x9c\x96\xef\xb8\x8f\xe2\x9c\x96\xef\xb8\x8f\nLaporan kekerasan seksual meningkat \xe2\x9c\x94\xef\xb8\x8f\xe2\x9c\x94\xef\xb8\x8f\xe2\x9c\x94\xef\xb8\x8f\n\nPredator kampus\xe2\x80\xa6',b'rt @friendlyfrost: permendikbud ppks dirilis:\n\nseks bebas makin menggila \xe2\x9c\x96\xef\xb8\x8f\xe2\x9c\x96\xef\xb8\x8f\xe2\x9c\x96\xef\xb8\x8f\nlaporan kekerasan seksual meningkat \xe2\x9c\x94\xef\xb8\x8f\xe2\x9c\x94\xef\xb8\x8f\xe2\x9c\x94\xef\xb8\x8f\n\npredator kampus\xe2\x80\xa6',permendikbud ppks dirilis nseks bebas makin menggila xef xb xef xb xef xb nlaporan kekerasan seksual meningkat xef xb xef xb xef xb npredator kampus,"['permendikbud', 'ppks', 'dirilis', 'nseks', 'bebas', 'makin', 'menggila', 'xef', 'xb', 'xef', 'xb', 'xef', 'xb', 'nlaporan', 'kekerasan', 'seksual', 'meningkat', 'xef', 'xb', 'xef', 'xb', 'xef', 'xb', 'npredator', 'kampus']","['permendukbidristek', 'ppks', 'dirilis', 'nseks', 'bebas', 'makin', 'menggila', 'xef', 'xb', 'xef', 'xb', 'xef', 'xb', 'nlaporan', 'kekerasan', 'seksual', 'meningkat', 'xef', 'xb', 'xef', 'xb', 'xef', 'xb', 'npredator', 'kampus']",permendukbidristek ppks dirilis nseks bebas menggila nlaporan kekerasan seksual meningkat npredator kampus,"['permendukbidristek', 'ppks', 'rilis', 'nseks', 'bebas', 'gila', 'nlaporan', 'keras', 'seksual', 'tingkat', 'npredator', 'kampus']"
3011,11/23/2021 3:58,1.46299e+18,BEM PM UDAYANA,"b'Permendikbud PPKS ini disinyalir melegalkan zina, padahal konsep ""Consent"" yang terkandung didalamnya memiliki pema\xe2\x80\xa6 https://t.co/qF1pEeC99V'","b'permendikbud ppks ini disinyalir melegalkan zina, padahal konsep ""consent"" yang terkandung didalamnya memiliki pema\xe2\x80\xa6 https://t.co/qf1peec99v'",permendikbud ppks ini disinyalir melegalkan zina padahal konsep consent yang terkandung didalamnya memiliki pema,"['permendikbud', 'ppks', 'ini', 'disinyalir', 'melegalkan', 'zina', 'padahal', 'konsep', 'consent', 'yang', 'terkandung', 'didalamnya', 'memiliki', 'pema']","['permendukbidristek', 'ppks', 'ini', 'disinyalir', 'melegalkan', 'zina', 'padahal', 'konsep', 'consent', 'yang', 'terkandung', 'didalamnya', 'memiliki', 'pema']",permendukbidristek ppks disinyalir melegalkan zina konsep consent terkandung didalamnya memiliki pema,"['permendukbidristek', 'ppks', 'sinyalir', 'legal', 'zina', 'konsep', 'consent', 'kandung', 'dalam', 'milik', 'pema']"
4120,11/22/2021 21:24,1.46289e+18,Ummu Fairuzah,"b'Perlukah permen PPKS diterapkan di lingkungan lembaga negara, agar korban mendapatkan perlindungan? Ternyata tidak\xe2\x80\xa6 https://t.co/CBMiA7sq2L'","b'perlukah permen ppks diterapkan di lingkungan lembaga negara, agar korban mendapatkan perlindungan? ternyata tidak\xe2\x80\xa6 https://t.co/cbmia7sq2l'",perlukah permen ppks diterapkan di lingkungan lembaga negara agar korban mendapatkan perlindungan ternyata tidak,"['perlukah', 'permen', 'ppks', 'diterapkan', 'di', 'lingkungan', 'lembaga', 'negara', 'agar', 'korban', 'mendapatkan', 'perlindungan', 'ternyata', 'tidak']","['perlukah', 'permendukbidristek', 'ppks', 'diterapkan', 'di', 'lingkungan', 'lembaga', 'negara', 'agar', 'korban', 'mendapatkan', 'perlindungan', 'ternyata', 'tidak']",permendukbidristek ppks diterapkan lingkungan lembaga negara korban perlindungan,"['permendukbidristek', 'ppks', 'terap', 'lingkung', 'lembaga', 'negara', 'korban', 'lindung']"
1567,11/23/2021 14:56,1.46316e+18,Anna,"b'RT @FairuzahUmmu: @CNNIndonesia Perlukah permen PPKS diterapkan di lingkungan lembaga negara, agar korban mendapatkan perlindungan? Ternyat\xe2\x80\xa6'","b'rt @fairuzahummu: @cnnindonesia perlukah permen ppks diterapkan di lingkungan lembaga negara, agar korban mendapatkan perlindungan? ternyat\xe2\x80\xa6'",perlukah permen ppks diterapkan di lingkungan lembaga negara agar korban mendapatkan perlindungan ternyat,"['perlukah', 'permen', 'ppks', 'diterapkan', 'di', 'lingkungan', 'lembaga', 'negara', 'agar', 'korban', 'mendapatkan', 'perlindungan', 'ternyat']","['perlukah', 'permendukbidristek', 'ppks', 'diterapkan', 'di', 'lingkungan', 'lembaga', 'negara', 'agar', 'korban', 'mendapatkan', 'perlindungan', 'ternyat']",permendukbidristek ppks diterapkan lingkungan lembaga negara korban perlindungan ternyat,"['permendukbidristek', 'ppks', 'terap', 'lingkung', 'lembaga', 'negara', 'korban', 'lindung', 'ternyat']"
3354,11/23/2021 2:29,1.46297e+18,Santiko Restuadhi,b'permendikbud PPKS apa bisa diterapkan juga di RS untuk KS konsulen ke koas/ppds?',b'permendikbud ppks apa bisa diterapkan juga di rs untuk ks konsulen ke koas/ppds?',permendikbud ppks apa bisa diterapkan juga di rs untuk ks konsulen ke koas ppds,"['permendikbud', 'ppks', 'apa', 'bisa', 'diterapkan', 'juga', 'di', 'rs', 'untuk', 'ks', 'konsulen', 'ke', 'koas', 'ppds']","['permendukbidristek', 'ppks', 'apa', 'bisa', 'diterapkan', 'juga', 'di', 'rs', 'untuk', 'ks', 'konsulen', 'ke', 'koas', 'ppds']",permendukbidristek ppks diterapkan rs ks konsulen koas ppds,"['permendukbidristek', 'ppks', 'terap', 'rs', 'ks', 'konsulen', 'koas', 'ppds']"
5411,11/20/2021 15:24,1.46208e+18,A,b'@AREAJULID Permen PPKS klu bener2 diaplikasikan bakal bisa memberantas predator seksual didunia pendidikan.',b'@areajulid permen ppks klu bener2 diaplikasikan bakal bisa memberantas predator seksual didunia pendidikan.',permen ppks klu bener diaplikasikan bakal bisa memberantas predator seksual didunia pendidikan,"['permen', 'ppks', 'klu', 'bener', 'diaplikasikan', 'bakal', 'bisa', 'memberantas', 'predator', 'seksual', 'didunia', 'pendidikan']","['permendukbidristek', 'ppks', 'klu', 'bener', 'diaplikasikan', 'bakal', 'bisa', 'memberantas', 'predator', 'seksual', 'didunia', 'pendidikan']",permendukbidristek ppks klu bener diaplikasikan memberantas predator seksual didunia pendidikan,"['permendukbidristek', 'ppks', 'klu', 'bener', 'aplikasi', 'berantas', 'predator', 'seksual', 'dunia', 'didik']"
5380,11/21/2021 8:14,1.46233e+18,godMei memvaksin~,"b'RT @CharlenneKayla: Permen PPKS bukan hanya untuk mahasiswa, tapi untuk seluruh sivitas akademika. Di kampus, kekerasan seksual bukan hanya\xe2\x80\xa6'","b'rt @charlennekayla: permen ppks bukan hanya untuk mahasiswa, tapi untuk seluruh sivitas akademika. di kampus, kekerasan seksual bukan hanya\xe2\x80\xa6'",permen ppks bukan hanya untuk mahasiswa tapi untuk seluruh sivitas akademika di kampus kekerasan seksual bukan hanya,"['permen', 'ppks', 'bukan', 'hanya', 'untuk', 'mahasiswa', 'tapi', 'untuk', 'seluruh', 'sivitas', 'akademika', 'di', 'kampus', 'kekerasan', 'seksual', 'bukan', 'hanya']","['permendukbidristek', 'ppks', 'bukan', 'hanya', 'untuk', 'mahasiswa', 'tapi', 'untuk', 'seluruh', 'sivitas', 'akademika', 'di', 'kampus', 'kekerasan', 'seksual', 'bukan', 'hanya']",permendukbidristek ppks mahasiswa sivitas akademika kampus kekerasan seksual,"['permendukbidristek', 'ppks', 'mahasiswa', 'sivitas', 'akademika', 'kampus', 'keras', 'seksual']"
977,11/25/2021 3:23,1.46371e+18,tegas.co,"b'Permendikbud PPKS, Mengatasi Masalah dengan\xc2\xa0Masalah https://t.co/ViUSoS97DW'","b'permendikbud ppks, mengatasi masalah dengan\xc2\xa0masalah https://t.co/viusos97dw'",permendikbud ppks mengatasi masalah dengan xc masalah,"['permendikbud', 'ppks', 'mengatasi', 'masalah', 'dengan', 'xc', 'masalah']","['permendukbidristek', 'ppks', 'mengatasi', 'masalah', 'dengan', 'xc', 'masalah']",permendukbidristek ppks mengatasi,"['permendukbidristek', 'ppks', 'atas']"
5381,11/21/2021 7:57,1.46233e+18,stefanywoody,b'RT @CakraWikara: [PERMEN PPKS]\n\n@Kemdikbud_RI baru saja mengesahkan Peraturan Menteri (Permen) Nomor 30 Tahun 2021 tentang Pencegahan dan P\xe2\x80\xa6',b'rt @cakrawikara: [permen ppks]\n\n@kemdikbud_ri baru saja mengesahkan peraturan menteri (permen) nomor 30 tahun 2021 tentang pencegahan dan p\xe2\x80\xa6',permen ppks baru saja mengesahkan peraturan menteri permen nomor tahun tentang pencegahan dan,"['permen', 'ppks', 'baru', 'saja', 'mengesahkan', 'peraturan', 'menteri', 'permen', 'nomor', 'tahun', 'tentang', 'pencegahan', 'dan']","['permendukbidristek', 'ppks', 'baru', 'saja', 'mengesahkan', 'peraturan', 'menteri', 'permendukbidristek', 'nomor', 'tahun', 'tentang', 'pencegahan', 'dan']",permendukbidristek ppks mengesahkan peraturan menteri permendukbidristek nomor pencegahan,"['permendukbidristek', 'ppks', 'kesah', 'atur', 'menteri', 'permendukbidristek', 'nomor', 'cegah']"
536,11/26/2021 12:00,1.4642e+18,CNN Indonesia,"b'Permendikbud PPKS menuai kecaman dari berbagai pihak karena dianggap melegalkan perzinaan. Menurut Nadiem, ia mener\xe2\x80\xa6 https://t.co/5kB4SWAwhN'","b'permendikbud ppks menuai kecaman dari berbagai pihak karena dianggap melegalkan perzinaan. menurut nadiem, ia mener\xe2\x80\xa6 https://t.co/5kb4swawhn'",permendikbud ppks menuai kecaman dari berbagai pihak karena dianggap melegalkan perzinaan menurut nadiem ia mener,"['permendikbud', 'ppks', 'menuai', 'kecaman', 'dari', 'berbagai', 'pihak', 'karena', 'dianggap', 'melegalkan', 'perzinaan', 'menurut', 'nadiem', 'ia', 'mener']","['permendukbidristek', 'ppks', 'menuai', 'kecaman', 'dari', 'berbagai', 'pihak', 'karena', 'dianggap', 'melegalkan', 'perzinaan', 'menurut', 'nadiem', 'ia', 'mener']",permendukbidristek ppks menuai kecaman dianggap melegalkan perzinaan nadiem mener,"['permendukbidristek', 'ppks', 'tuai', 'kecam', 'anggap', 'legal', 'zina', 'nadiem', 'ter']"
22,11/28/2021 4:42,1.46482e+18,Ta,"b'RT @CNNIndonesia: Permendikbud PPKS menuai kecaman dari berbagai pihak karena dianggap melegalkan perzinaan. Menurut Nadiem, ia menerbitkan\xe2\x80\xa6'","b'rt @cnnindonesia: permendikbud ppks menuai kecaman dari berbagai pihak karena dianggap melegalkan perzinaan. menurut nadiem, ia menerbitkan\xe2\x80\xa6'",permendikbud ppks menuai kecaman dari berbagai pihak karena dianggap melegalkan perzinaan menurut nadiem ia menerbitkan,"['permendikbud', 'ppks', 'menuai', 'kecaman', 'dari', 'berbagai', 'pihak', 'karena', 'dianggap', 'melegalkan', 'perzinaan', 'menurut', 'nadiem', 'ia', 'menerbitkan']","['permendukbidristek', 'ppks', 'menuai', 'kecaman', 'dari', 'berbagai', 'pihak', 'karena', 'dianggap', 'melegalkan', 'perzinaan', 'menurut', 'nadiem', 'ia', 'menerbitkan']",permendukbidristek ppks menuai kecaman dianggap melegalkan perzinaan nadiem menerbitkan,"['permendukbidristek', 'ppks', 'tuai', 'kecam', 'anggap', 'legal', 'zina', 'nadiem', 'terbit']"
1092,11/24/2021 6:34,1.4634e+18,Andespen,b'Soal Permendikbud PPKS \nAndi Akmal Harap Nadiem Dengerin Aspirasi Masyarakat\n\n#NadiemMakarim #ppks #permendikbud30\xe2\x80\xa6 https://t.co/Xl09krf1NJ',b'soal permendikbud ppks \nandi akmal harap nadiem dengerin aspirasi masyarakat\n\n#nadiemmakarim #ppks #permendikbud30\xe2\x80\xa6 https://t.co/xl09krf1nj',soal permendikbud ppks nandi akmal harap nadiem dengerin aspirasi masyarakat,"['soal', 'permendikbud', 'ppks', 'nandi', 'akmal', 'harap', 'nadiem', 'dengerin', 'aspirasi', 'masyarakat']","['soal', 'permendukbidristek', 'ppks', 'nandi', 'akmal', 'harap', 'nadiem', 'dengerin', 'aspirasi', 'masyarakat']",permendukbidristek ppks nandi akmal harap nadiem dengerin aspirasi masyarakat,"['permendukbidristek', 'ppks', 'nandi', 'akmal', 'harap', 'nadiem', 'dengerin', 'aspirasi', 'masyarakat']"
1067,11/24/2021 8:49,1.46343e+18,suaradotcom,b'Permendikbud PPKS Harus Jadi Pelecut DPR Segera Sahkan RUU TPKS  https://t.co/oKzYOtfSnm',b'permendikbud ppks harus jadi pelecut dpr segera sahkan ruu tpks  https://t.co/okzyotfsnm',permendikbud ppks harus jadi pelecut dpr segera sahkan ruu tpks,"['permendikbud', 'ppks', 'harus', 'jadi', 'pelecut', 'dpr', 'segera', 'sahkan', 'ruu', 'tpks']","['permendukbidristek', 'ppks', 'harus', 'jadi', 'pelecut', 'dpr', 'segera', 'sahkan', 'ruu', 'tpks']",permendukbidristek ppks pelecut dpr sahkan ruu tpks,"['permendukbidristek', 'ppks', 'lecut', 'dpr', 'sahkan', 'ruu', 'tpks']"
1180,11/24/2021 2:43,1.46334e+18,SUARA ISLAM ONLINE,b'Permen PPKS Bukan Solusi Kekerasan Seksual https://t.co/qXhmWhzHRC lewat @suaraislam_id',b'permen ppks bukan solusi kekerasan seksual https://t.co/qxhmwhzhrc lewat @suaraislam_id',permen ppks bukan solusi kekerasan seksual lewat,"['permen', 'ppks', 'bukan', 'solusi', 'kekerasan', 'seksual', 'lewat']","['permendukbidristek', 'ppks', 'bukan', 'solusi', 'kekerasan', 'seksual', 'lewat']",permendukbidristek ppks solusi kekerasan seksual,"['permendukbidristek', 'ppks', 'solusi', 'keras', 'seksual']"
5373,11/21/2021 13:53,1.46242e+18,rknews,b'Permendikbud PPKS Solusikah? https://t.co/Fw4KFcOZAA',b'permendikbud ppks solusikah? https://t.co/fw4kfcozaa',permendikbud ppks solusikah,"['permendikbud', 'ppks', 'solusikah']","['permendukbidristek', 'ppks', 'solusikah']",permendukbidristek ppks solusikah,"['permendukbidristek', 'ppks', 'solusi']"
2904,11/23/2021 4:31,1.463e+18,Harian Jogja,"b'Permendikbud PPKS Tua Pro-Kontra, Nadiem Minta Masukan PBNU https://t.co/DclrukaB1t #beritajogja #jogja\xe2\x80\xa6 https://t.co/I7gZvLZpoA'","b'permendikbud ppks tua pro-kontra, nadiem minta masukan pbnu https://t.co/dclrukab1t #beritajogja #jogja\xe2\x80\xa6 https://t.co/i7gzvlzpoa'",permendikbud ppks tua pro kontra nadiem minta masukan pbnu,"['permendikbud', 'ppks', 'tua', 'pro', 'kontra', 'nadiem', 'minta', 'masukan', 'pbnu']","['permendukbidristek', 'ppks', 'tuai', 'dukung', 'tolak', 'nadiem', 'minta', 'masukan', 'pbnu']",permendukbidristek ppks tuai dukung tolak nadiem masukan pbnu,"['permendukbidristek', 'ppks', 'tuai', 'dukung', 'tolak', 'nadiem', 'masuk', 'pbnu']"
1059,11/24/2021 9:10,1.46343e+18,Ummu Fairuzah,b'@TofaTofa_id Perlu dibuat permen PPKS utk lingkungan gereja gitu gak harusnya. Masak kampus saja?',b'@tofatofa_id perlu dibuat permen ppks utk lingkungan gereja gitu gak harusnya. masak kampus saja?',perlu dibuat permen ppks utk lingkungan gereja gitu gak harusnya masak kampus saja,"['perlu', 'dibuat', 'permen', 'ppks', 'utk', 'lingkungan', 'gereja', 'gitu', 'gak', 'harusnya', 'masak', 'kampus', 'saja']","['perlu', 'dibuat', 'permendukbidristek', 'ppks', 'utk', 'lingkungan', 'gereja', 'gitu', 'tidak', 'harusnya', 'masak', 'kampus', 'saja']",permendukbidristek ppks utk lingkungan gereja gitu masak kampus,"['permendukbidristek', 'ppks', 'utk', 'lingkung', 'gereja', 'gitu', 'masak', 'kampus']"
930,11/25/2021 14:52,1.46388e+18,EM UB 2021,b'[PERMENDIKBUD-RISTEK NO 30 TAHUN 2021 SEBAGAI SOLUSI DARI FENOMENA KEKERASAN SEKSUAL DI PERGURUAN TINGGI]\n\nMenteri\xe2\x80\xa6 https://t.co/OkD2idZQmM',b'[permendikbud-ristek no 30 tahun 2021 sebagai solusi dari fenomena kekerasan seksual di perguruan tinggi]\n\nmenteri\xe2\x80\xa6 https://t.co/okd2idzqmm',permendikbud ristek no tahun sebagai solusi dari fenomena kekerasan seksual di perguruan tinggi nmenteri,"['permendikbud', 'ristek', 'no', 'tahun', 'sebagai', 'solusi', 'dari', 'fenomena', 'kekerasan', 'seksual', 'di', 'perguruan', 'tinggi', 'nmenteri']","['permendukbidristek', 'ristek', 'no', 'tahun', 'sebagai', 'solusi', 'dari', 'fenomena', 'kekerasan', 'seksual', 'di', 'perguruan', 'tinggi', 'nmenteri']",permendukbidristek ristek no solusi fenomena kekerasan seksual perguruan nmenteri,"['permendukbidristek', 'ristek', 'no', 'solusi', 'fenomena', 'keras', 'seksual', 'guru', 'nmenteri']"
919,11/25/2021 16:47,1.46391e+18,Dakwah Tidar,"b'RT @TintaSiyasiID: Permendikbud Ristek PPKS, Advokat: Bukan Harapan Tetapi Ancaman\n\nhttps://t.co/PUgSwckIi2'","b'rt @tintasiyasiid: permendikbud ristek ppks, advokat: bukan harapan tetapi ancaman\n\nhttps://t.co/pugswckii2'",permendikbud ristek ppks advokat bukan harapan tetapi ancaman,"['permendikbud', 'ristek', 'ppks', 'advokat', 'bukan', 'harapan', 'tetapi', 'ancaman']","['permendukbidristek', 'ristek', 'ppks', 'advokat', 'bukan', 'harapan', 'tetapi', 'ancaman']",permendukbidristek ristek ppks advokat harapan ancaman,"['permendukbidristek', 'ristek', 'ppks', 'advokat', 'harap', 'ancam']"
94,11/27/2021 11:31,1.46456e+18,wed,b'RT @HopeHelpsNet: Permendikbud-Ristek PPKS menjelaskan langkah awal penciptaan ruang aman di lingkungan kampus. Gimana sih caranya nyiptain\xe2\x80\xa6',b'rt @hopehelpsnet: permendikbud-ristek ppks menjelaskan langkah awal penciptaan ruang aman di lingkungan kampus. gimana sih caranya nyiptain\xe2\x80\xa6',permendikbud ristek ppks menjelaskan langkah awal penciptaan ruang aman di lingkungan kampus gimana sih caranya nyiptain,"['permendikbud', 'ristek', 'ppks', 'menjelaskan', 'langkah', 'awal', 'penciptaan', 'ruang', 'aman', 'di', 'lingkungan', 'kampus', 'gimana', 'sih', 'caranya', 'nyiptain']","['permendukbidristek', 'ristek', 'ppks', 'menjelaskan', 'langkah', 'awal', 'penciptaan', 'ruang', 'aman', 'di', 'lingkungan', 'kampus', 'gimana', 'sih', 'caranya', 'ciptakan']",permendukbidristek ristek ppks langkah penciptaan ruang aman lingkungan kampus gimana sih ciptakan,"['permendukbidristek', 'ristek', 'ppks', 'langkah', 'cipta', 'ruang', 'aman', 'lingkung', 'kampus', 'gimana', 'sih', 'cipta']"
145,11/27/2021 5:39,1.46447e+18,HopeHelps Network,b'Permendikbud-Ristek PPKS menjelaskan langkah awal penciptaan ruang aman di lingkungan kampus. Gimana sih caranya ny\xe2\x80\xa6 https://t.co/yHbmoKOWuK',b'permendikbud-ristek ppks menjelaskan langkah awal penciptaan ruang aman di lingkungan kampus. gimana sih caranya ny\xe2\x80\xa6 https://t.co/yhbmokowuk',permendikbud ristek ppks menjelaskan langkah awal penciptaan ruang aman di lingkungan kampus gimana sih caranya ny,"['permendikbud', 'ristek', 'ppks', 'menjelaskan', 'langkah', 'awal', 'penciptaan', 'ruang', 'aman', 'di', 'lingkungan', 'kampus', 'gimana', 'sih', 'caranya', 'ny']","['permendukbidristek', 'ristek', 'ppks', 'menjelaskan', 'langkah', 'awal', 'penciptaan', 'ruang', 'aman', 'di', 'lingkungan', 'kampus', 'gimana', 'sih', 'caranya', 'ny']",permendukbidristek ristek ppks langkah penciptaan ruang aman lingkungan kampus gimana sih ny,"['permendukbidristek', 'ristek', 'ppks', 'langkah', 'cipta', 'ruang', 'aman', 'lingkung', 'kampus', 'gimana', 'sih', 'ny']"
5419,11/20/2021 14:03,1.46206e+18,TintaSiyasi.com,"b'Permendikbud Ristek PPKS, Liberalisasi Seksual Menyasar Institusi PT\n\nOleh: Zulia Adi K, S.E\n[Pengamat Pendidikan]\nhttps://t.co/fjGmykCffj'","b'permendikbud ristek ppks, liberalisasi seksual menyasar institusi pt\n\noleh: zulia adi k, s.e\n[pengamat pendidikan]\nhttps://t.co/fjgmykcffj'",permendikbud ristek ppks liberalisasi seksual menyasar institusi pt noleh zulia adi pengamat pendidikan,"['permendikbud', 'ristek', 'ppks', 'liberalisasi', 'seksual', 'menyasar', 'institusi', 'pt', 'noleh', 'zulia', 'adi', 'pengamat', 'pendidikan']","['permendukbidristek', 'ristek', 'ppks', 'liberalisasi', 'seksual', 'menyasar', 'institusi', 'pt', 'oleh', 'zulia', 'adi', 'pengamat', 'pendidikan']",permendukbidristek ristek ppks liberalisasi seksual menyasar institusi pt zulia adi pengamat pendidikan,"['permendukbidristek', 'ristek', 'ppks', 'liberalisasi', 'seksual', 'sasar', 'institusi', 'pt', 'zulia', 'adi', 'amat', 'didik']"
