,Date,ID,Username,Tweets,case folding,data cleaning,tokenisasi,normalisasi,stopwords,stemming
1,11/28/2021 21:58,1.46508e+18,Tuty Herawati,b'Mendukung Permendikbud Ristek 30 / 2021 tentang PPKS di lingkungan perguruan tinggi. Permen ini menjadi langkah awa\xe2\x80\xa6 https://t.co/Yb1umgPjTg',b'mendukung permendikbud ristek 30 / 2021 tentang ppks di lingkungan perguruan tinggi. permen ini menjadi langkah awa\xe2\x80\xa6 https://t.co/yb1umgpjtg',mendukung permendikbud ristek tentang ppks di lingkungan perguruan tinggi permen ini menjadi langkah awa,"['mendukung', 'permendikbud', 'ristek', 'tentang', 'ppks', 'di', 'lingkungan', 'perguruan', 'tinggi', 'permen', 'ini', 'menjadi', 'langkah', 'awa']","['mendukung', 'permendukbidristek', 'ristek', 'tentang', 'ppks', 'di', 'lingkungan', 'perguruan', 'tinggi', 'permendukbidristek', 'ini', 'menjadi', 'langkah', 'awa']",mendukung permendukbidristek ristek ppks lingkungan perguruan permendukbidristek langkah awa,"['dukung', 'permendukbidristek', 'ristek', 'ppks', 'lingkung', 'guru', 'permendukbidristek', 'langkah', 'awa']"
9,11/28/2021 12:40,1.46494e+18,godMei memvaksin~,b'RT @LBHBWCC: Mendukung Permendikbud Ristek 30/2021 tentang PPKS di lingkungan perguruan tinggi. Permen ini menjadi langkah awal untuk melaw\xe2\x80\xa6',b'rt @lbhbwcc: mendukung permendikbud ristek 30/2021 tentang ppks di lingkungan perguruan tinggi. permen ini menjadi langkah awal untuk melaw\xe2\x80\xa6',mendukung permendikbud ristek tentang ppks di lingkungan perguruan tinggi permen ini menjadi langkah awal untuk melaw,"['mendukung', 'permendikbud', 'ristek', 'tentang', 'ppks', 'di', 'lingkungan', 'perguruan', 'tinggi', 'permen', 'ini', 'menjadi', 'langkah', 'awal', 'untuk', 'melaw']","['mendukung', 'permendukbidristek', 'ristek', 'tentang', 'ppks', 'di', 'lingkungan', 'perguruan', 'tinggi', 'permendukbidristek', 'ini', 'menjadi', 'langkah', 'awal', 'untuk', 'melaw']",mendukung permendukbidristek ristek ppks lingkungan perguruan permendukbidristek langkah melaw,"['dukung', 'permendukbidristek', 'ristek', 'ppks', 'lingkung', 'guru', 'permendukbidristek', 'langkah', 'melaw']"
5420,11/20/2021 14:03,1.46206e+18,rinamulya,"b'Menilik isi Permen PPKS,tampak jelas pertentangannya dengan ajaran Islam danmembahayakan umat.Permen ini,jika diter\xe2\x80\xa6 https://t.co/NL9K3wqNP0'","b'menilik isi permen ppks,tampak jelas pertentangannya dengan ajaran islam danmembahayakan umat.permen ini,jika diter\xe2\x80\xa6 https://t.co/nl9k3wqnp0'",menilik isi permen ppks tampak jelas pertentangannya dengan ajaran islam danmembahayakan umat permen ini jika diter,"['menilik', 'isi', 'permen', 'ppks', 'tampak', 'jelas', 'pertentangannya', 'dengan', 'ajaran', 'islam', 'danmembahayakan', 'umat', 'permen', 'ini', 'jika', 'diter']","['menilik', 'isi', 'permendukbidristek', 'ppks', 'tampak', 'jelas', 'pertentangannya', 'dengan', 'ajaran', 'islam', 'danmembahayakan', 'umat', 'permendukbidristek', 'ini', 'jika', 'diter']",menilik isi permendukbidristek ppks pertentangannya ajaran islam danmembahayakan umat permendukbidristek diter,"['tilik', 'isi', 'permendukbidristek', 'ppks', 'tentang', 'ajar', 'islam', 'danmembahayakan', 'umat', 'permendukbidristek', 'ter']"
5435,11/20/2021 12:43,1.46204e+18,yulkurniawati,"b'#Kaffah \xe2\x80\x94 Menilik isi Permen PPKS, tampak jelas pertentangannya dengan ajaran Islam dan membahayakan umat. Permen i\xe2\x80\xa6 https://t.co/T6mudU0HGT'","b'#kaffah \xe2\x80\x94 menilik isi permen ppks, tampak jelas pertentangannya dengan ajaran islam dan membahayakan umat. permen i\xe2\x80\xa6 https://t.co/t6mudu0hgt'",menilik isi permen ppks tampak jelas pertentangannya dengan ajaran islam dan membahayakan umat permen,"['menilik', 'isi', 'permen', 'ppks', 'tampak', 'jelas', 'pertentangannya', 'dengan', 'ajaran', 'islam', 'dan', 'membahayakan', 'umat', 'permen']","['menilik', 'isi', 'permendukbidristek', 'ppks', 'tampak', 'jelas', 'pertentangannya', 'dengan', 'ajaran', 'islam', 'dan', 'membahayakan', 'umat', 'permendukbidristek']",menilik isi permendukbidristek ppks pertentangannya ajaran islam membahayakan umat permendukbidristek,"['tilik', 'isi', 'permendukbidristek', 'ppks', 'tentang', 'ajar', 'islam', 'bahaya', 'umat', 'permendukbidristek']"
5415,11/20/2021 14:29,1.46207e+18,Umma Fatih,"b'Menilik isi Permen PPKS, tampak jelas pertentangannya dg ajaran Islam dan membahayakan umat. Permen ini, jk diterap\xe2\x80\xa6 https://t.co/henY9VBquH'","b'menilik isi permen ppks, tampak jelas pertentangannya dg ajaran islam dan membahayakan umat. permen ini, jk diterap\xe2\x80\xa6 https://t.co/heny9vbquh'",menilik isi permen ppks tampak jelas pertentangannya dg ajaran islam dan membahayakan umat permen ini jk diterap,"['menilik', 'isi', 'permen', 'ppks', 'tampak', 'jelas', 'pertentangannya', 'dg', 'ajaran', 'islam', 'dan', 'membahayakan', 'umat', 'permen', 'ini', 'jk', 'diterap']","['menilik', 'isi', 'permendukbidristek', 'ppks', 'tampak', 'jelas', 'pertentangannya', 'dg', 'ajaran', 'islam', 'dan', 'membahayakan', 'umat', 'permendukbidristek', 'ini', 'jk', 'diterap']",menilik isi permendukbidristek ppks pertentangannya dg ajaran islam membahayakan umat permendukbidristek jk diterap,"['tilik', 'isi', 'permendukbidristek', 'ppks', 'tentang', 'dg', 'ajar', 'islam', 'bahaya', 'umat', 'permendukbidristek', 'jk', 'terap']"
51,11/27/2021 15:04,1.46461e+18,Mel,b'E a menina no tiktok q tem 2 ppks ?! \xf0\x9f\x90\xb8\xf0\x9f\x90\xb8',b'e a menina no tiktok q tem 2 ppks ?! \xf0\x9f\x90\xb8\xf0\x9f\x90\xb8',menina no tiktok tem ppks xf xb xf xb,"['menina', 'no', 'tiktok', 'tem', 'ppks', 'xf', 'xb', 'xf', 'xb']","['menina', 'no', 'tiktok', 'tem', 'ppks', 'xf', 'xb', 'xf', 'xb']",menina no tiktok tem ppks,"['menina', 'no', 'tiktok', 'tem', 'ppks']"
5023,11/22/2021 12:10,1.46276e+18,VOI.id,"b'Menteri Pendidikan, Kebudayaan, Riset dan Teknologi (Mendikbudristek) Nadiem Makarim menyambangi PBNU untuk memberi\xe2\x80\xa6 https://t.co/3DSSKOVSkO'","b'menteri pendidikan, kebudayaan, riset dan teknologi (mendikbudristek) nadiem makarim menyambangi pbnu untuk memberi\xe2\x80\xa6 https://t.co/3dsskovsko'",menteri pendidikan kebudayaan riset dan teknologi mendikbudristek nadiem makarim menyambangi pbnu untuk memberi,"['menteri', 'pendidikan', 'kebudayaan', 'riset', 'dan', 'teknologi', 'mendikbudristek', 'nadiem', 'makarim', 'menyambangi', 'pbnu', 'untuk', 'memberi']","['menteri', 'pendidikan', 'kebudayaan', 'riset', 'dan', 'teknologi', 'mendikbudristek', 'nadiem', 'makarim', 'menyambangi', 'pbnu', 'untuk', 'memberi']",menteri pendidikan kebudayaan riset teknologi mendikbudristek nadiem makarim menyambangi pbnu,"['menteri', 'didik', 'budaya', 'riset', 'teknologi', 'mendikbudristek', 'nadiem', 'makarim', 'sambang', 'pbnu']"
4983,11/22/2021 12:37,1.46276e+18,Show Men,"b'RT @voidotid: Menteri Pendidikan, Kebudayaan, Riset dan Teknologi (Mendikbudristek) Nadiem Makarim menyambangi PBNU untuk memberi klarifika\xe2\x80\xa6'","b'rt @voidotid: menteri pendidikan, kebudayaan, riset dan teknologi (mendikbudristek) nadiem makarim menyambangi pbnu untuk memberi klarifika\xe2\x80\xa6'",menteri pendidikan kebudayaan riset dan teknologi mendikbudristek nadiem makarim menyambangi pbnu untuk memberi klarifika,"['menteri', 'pendidikan', 'kebudayaan', 'riset', 'dan', 'teknologi', 'mendikbudristek', 'nadiem', 'makarim', 'menyambangi', 'pbnu', 'untuk', 'memberi', 'klarifika']","['menteri', 'pendidikan', 'kebudayaan', 'riset', 'dan', 'teknologi', 'mendikbudristek', 'nadiem', 'makarim', 'menyambangi', 'pbnu', 'untuk', 'memberi', 'klarifikasi']",menteri pendidikan kebudayaan riset teknologi mendikbudristek nadiem makarim menyambangi pbnu klarifikasi,"['menteri', 'didik', 'budaya', 'riset', 'teknologi', 'mendikbudristek', 'nadiem', 'makarim', 'sambang', 'pbnu', 'klarifikasi']"
5241,11/22/2021 9:21,1.46271e+18,Catch Me Up!,"b'Setelah menuai pro dan kontra, Permendikbud PPKS udah resmi berlaku nih gengs. \n\nMakin ke sini, ternyata makin bany\xe2\x80\xa6 https://t.co/9UxH8i4goq'","b'setelah menuai pro dan kontra, permendikbud ppks udah resmi berlaku nih gengs. \n\nmakin ke sini, ternyata makin bany\xe2\x80\xa6 https://t.co/9uxh8i4goq'",setelah menuai pro dan kontra permendikbud ppks udah resmi berlaku nih gengs nmakin ke sini ternyata makin bany,"['setelah', 'menuai', 'pro', 'dan', 'kontra', 'permendikbud', 'ppks', 'udah', 'resmi', 'berlaku', 'nih', 'gengs', 'nmakin', 'ke', 'sini', 'ternyata', 'makin', 'bany']","['setelah', 'menuai', 'dukung', 'dan', 'tolak', 'permendukbidristek', 'ppks', 'sudah', 'resmi', 'berlaku', 'nih', 'gengs', 'makin', 'ke', 'sini', 'ternyata', 'makin', 'banyak']",menuai dukung tolak permendukbidristek ppks resmi berlaku nih gengs,"['tuai', 'dukung', 'tolak', 'permendukbidristek', 'ppks', 'resmi', 'laku', 'nih', 'gengs']"
3737,11/23/2021 0:38,1.46294e+18,haru.,"b'RT @catchmeupid: Setelah menuai pro dan kontra, Permendikbud PPKS udah resmi berlaku nih gengs. \n\nMakin ke sini, ternyata makin banyak korb\xe2\x80\xa6'","b'rt @catchmeupid: setelah menuai pro dan kontra, permendikbud ppks udah resmi berlaku nih gengs. \n\nmakin ke sini, ternyata makin banyak korb\xe2\x80\xa6'",setelah menuai pro dan kontra permendikbud ppks udah resmi berlaku nih gengs nmakin ke sini ternyata makin banyak korb,"['setelah', 'menuai', 'pro', 'dan', 'kontra', 'permendikbud', 'ppks', 'udah', 'resmi', 'berlaku', 'nih', 'gengs', 'nmakin', 'ke', 'sini', 'ternyata', 'makin', 'banyak', 'korb']","['setelah', 'menuai', 'dukung', 'dan', 'tolak', 'permendukbidristek', 'ppks', 'sudah', 'resmi', 'berlaku', 'nih', 'gengs', 'makin', 'ke', 'sini', 'ternyata', 'makin', 'banyak', 'korb']",menuai dukung tolak permendukbidristek ppks resmi berlaku nih gengs korb,"['tuai', 'dukung', 'tolak', 'permendukbidristek', 'ppks', 'resmi', 'laku', 'nih', 'gengs', 'korb']"
4784,11/22/2021 14:17,1.46279e+18,eris 🍓,b'@bertanyarl Menurutku yaah laporan kekerasan seksual meningkat tuh yaa karena para korban udah merasa cukup dilindu\xe2\x80\xa6 https://t.co/Dmy7iaxAbL',b'@bertanyarl menurutku yaah laporan kekerasan seksual meningkat tuh yaa karena para korban udah merasa cukup dilindu\xe2\x80\xa6 https://t.co/dmy7iaxabl',menurutku yaah laporan kekerasan seksual meningkat tuh yaa karena para korban udah merasa cukup dilindu,"['menurutku', 'yaah', 'laporan', 'kekerasan', 'seksual', 'meningkat', 'tuh', 'yaa', 'karena', 'para', 'korban', 'udah', 'merasa', 'cukup', 'dilindu']","['menurutku', 'yaah', 'laporan', 'kekerasan', 'seksual', 'meningkat', 'tuh', 'yaa', 'karena', 'para', 'korban', 'sudah', 'merasa', 'cukup', 'dilindu']",menurutku yaah laporan kekerasan seksual meningkat tuh yaa korban dilindu,"['turut', 'yaah', 'lapor', 'keras', 'seksual', 'tingkat', 'tuh', 'yaa', 'korban', 'lindu']"
3305,11/23/2021 2:44,1.46298e+18,Dee,"b'Jadi mikir, sebenernya banyak prospek nadiem makarim yang bagus2 bgt cuma covid ngrusak banyak planningnya dia.. Ta\xe2\x80\xa6 https://t.co/gE3ei2y1vO'","b'jadi mikir, sebenernya banyak prospek nadiem makarim yang bagus2 bgt cuma covid ngrusak banyak planningnya dia.. ta\xe2\x80\xa6 https://t.co/ge3ei2y1vo'",jadi mikir sebenernya banyak prospek nadiem makarim yang bagus bgt cuma covid ngrusak banyak planningnya dia ta,"['jadi', 'mikir', 'sebenernya', 'banyak', 'prospek', 'nadiem', 'makarim', 'yang', 'bagus', 'bgt', 'cuma', 'covid', 'ngrusak', 'banyak', 'planningnya', 'dia', 'ta']","['jadi', 'mikir', 'sebenernya', 'banyak', 'prospek', 'nadiem', 'makarim', 'yang', 'bagus', 'bgt', 'cuma', 'covid', 'merusak', 'banyak', 'planningnya', 'dia', 'ta']",mikir sebenernya prospek nadiem makarim bagus bgt covid merusak planningnya ta,"['mikir', 'sebenernya', 'prospek', 'nadiem', 'makarim', 'bagus', 'bgt', 'covid', 'rusak', 'planningnya', 'ta']"
4135,11/22/2021 21:04,1.46289e+18,EM UB 2021,"b'[MISKONSEPSI PERMENDIKBUDRISTEK PPKS]\n\nPeraturan Menteri Pendidikan, Kebudayaan, Riset dan Teknologi (Permendikbudr\xe2\x80\xa6 https://t.co/dkVKvCVdGH'","b'[miskonsepsi permendikbudristek ppks]\n\nperaturan menteri pendidikan, kebudayaan, riset dan teknologi (permendikbudr\xe2\x80\xa6 https://t.co/dkvkvcvdgh'",miskonsepsi permendikbudristek ppks nperaturan menteri pendidikan kebudayaan riset dan teknologi permendikbudr,"['miskonsepsi', 'permendikbudristek', 'ppks', 'nperaturan', 'menteri', 'pendidikan', 'kebudayaan', 'riset', 'dan', 'teknologi', 'permendikbudr']","['miskonsepsi', 'permendikbudristek', 'ppks', 'peraturan', 'menteri', 'pendidikan', 'kebudayaan', 'riset', 'dan', 'teknologi', 'permendikbudr']",miskonsepsi permendikbudristek ppks peraturan menteri pendidikan kebudayaan riset teknologi permendikbudr,"['miskonsepsi', 'permendikbudristek', 'ppks', 'atur', 'menteri', 'didik', 'budaya', 'riset', 'teknologi', 'permendikbudr']"
2857,11/23/2021 4:45,1.46301e+18,inez.,"b'moga-moga satgas PPKS ini beneran ada &amp; berjalan sesuai fungsi monitoring &amp; edukasinya, ngga cuman buat keren-keren\xe2\x80\xa6 https://t.co/jY7XdqEW1p'","b'moga-moga satgas ppks ini beneran ada &amp; berjalan sesuai fungsi monitoring &amp; edukasinya, ngga cuman buat keren-keren\xe2\x80\xa6 https://t.co/jy7xdqew1p'",moga moga satgas ppks ini beneran ada amp berjalan sesuai fungsi monitoring amp edukasinya ngga cuman buat keren keren,"['moga', 'moga', 'satgas', 'ppks', 'ini', 'beneran', 'ada', 'amp', 'berjalan', 'sesuai', 'fungsi', 'monitoring', 'amp', 'edukasinya', 'ngga', 'cuman', 'buat', 'keren', 'keren']","['moga', 'moga', 'satgas', 'ppks', 'ini', 'beneran', 'ada', 'amp', 'berjalan', 'sesuai', 'fungsi', 'monitoring', 'amp', 'edukasinya', 'ngga', 'cuman', 'buat', 'keren', 'keren']",moga moga satgas ppks beneran amp berjalan sesuai fungsi monitoring amp edukasinya ngga cuman keren keren,"['moga', 'moga', 'satgas', 'ppks', 'beneran', 'amp', 'jalan', 'sesuai', 'fungsi', 'monitoring', 'amp', 'edukasi', 'ngga', 'cuman', 'keren', 'keren']"
830,11/26/2021 6:18,1.46412e+18,Joe_2,"b'Mohon mahasiswa peserta demo di data, termasuk latar belakangnya.\nBenih2 yg bisa menjadi besar jk dibiarkan\xe2\x80\xa6 https://t.co/Bf15Txh7F9'","b'mohon mahasiswa peserta demo di data, termasuk latar belakangnya.\nbenih2 yg bisa menjadi besar jk dibiarkan\xe2\x80\xa6 https://t.co/bf15txh7f9'",mohon mahasiswa peserta demo di data termasuk latar belakangnya nbenih yg bisa menjadi besar jk dibiarkan,"['mohon', 'mahasiswa', 'peserta', 'demo', 'di', 'data', 'termasuk', 'latar', 'belakangnya', 'nbenih', 'yg', 'bisa', 'menjadi', 'besar', 'jk', 'dibiarkan']","['mohon', 'mahasiswa', 'peserta', 'demo', 'di', 'data', 'termasuk', 'latar', 'belakangnya', 'nbenih', 'yg', 'bisa', 'menjadi', 'besar', 'jk', 'dibiarkan']",mohon mahasiswa peserta demo data latar belakangnya nbenih yg jk dibiarkan,"['mohon', 'mahasiswa', 'serta', 'demo', 'data', 'latar', 'belakang', 'nbenih', 'yg', 'jk', 'biar']"
5425,11/20/2021 13:44,1.46205e+18,najla ka yelda,b'RT @MMC_IDN2: [Muslimah talk] Terbitnya Permendikbud No. 30 Thn 2021 tentang Pencegahan &amp; Penanganan Kekerasan Seksual  (PPKS) dipandang se\xe2\x80\xa6',b'rt @mmc_idn2: [muslimah talk] terbitnya permendikbud no. 30 thn 2021 tentang pencegahan &amp; penanganan kekerasan seksual  (ppks) dipandang se\xe2\x80\xa6',muslimah talk terbitnya permendikbud no thn tentang pencegahan amp penanganan kekerasan seksual ppks dipandang se,"['muslimah', 'talk', 'terbitnya', 'permendikbud', 'no', 'thn', 'tentang', 'pencegahan', 'amp', 'penanganan', 'kekerasan', 'seksual', 'ppks', 'dipandang', 'se']","['muslimah', 'talk', 'terbitnya', 'permendukbidristek', 'no', 'thn', 'tentang', 'pencegahan', 'amp', 'penanganan', 'kekerasan', 'seksual', 'ppks', 'dipandang', 'se']",muslimah talk terbitnya permendukbidristek no thn pencegahan amp penanganan kekerasan seksual ppks dipandang,"['muslimah', 'talk', 'terbit', 'permendukbidristek', 'no', 'thn', 'cegah', 'amp', 'tangan', 'keras', 'seksual', 'ppks', 'pandang']"
5417,11/20/2021 14:19,1.46206e+18,ilma,b'RT @muslimahnewscom: MuslimahNews \xe2\x80\x93 Apakah hadirnya Permen PPKS memang bisa menjadi penyelesaian efektif dan solutif bagi problem kekerasan\xe2\x80\xa6',b'rt @muslimahnewscom: muslimahnews \xe2\x80\x93 apakah hadirnya permen ppks memang bisa menjadi penyelesaian efektif dan solutif bagi problem kekerasan\xe2\x80\xa6',muslimahnews apakah hadirnya permen ppks memang bisa menjadi penyelesaian efektif dan solutif bagi problem kekerasan,"['muslimahnews', 'apakah', 'hadirnya', 'permen', 'ppks', 'memang', 'bisa', 'menjadi', 'penyelesaian', 'efektif', 'dan', 'solutif', 'bagi', 'problem', 'kekerasan']","['muslimahnews', 'apakah', 'hadirnya', 'permendukbidristek', 'ppks', 'memang', 'bisa', 'menjadi', 'penyelesaian', 'efektif', 'dan', 'solutif', 'bagi', 'problem', 'kekerasan']",muslimahnews hadirnya permendukbidristek ppks penyelesaian efektif solutif problem kekerasan,"['muslimahnews', 'hadir', 'permendukbidristek', 'ppks', 'selesai', 'efektif', 'solutif', 'problem', 'keras']"
5430,11/20/2021 13:19,1.46205e+18,raidaturrafida,"b'RT @muslimahnewscom: MuslimahNews \xe2\x80\x93 Mari saksikan Live Discussion MuslimahNewsCom dengan tema:\n\n""Permendikbud PPKS: Alat Pengokoh Paradigma\xe2\x80\xa6'","b'rt @muslimahnewscom: muslimahnews \xe2\x80\x93 mari saksikan live discussion muslimahnewscom dengan tema:\n\n""permendikbud ppks: alat pengokoh paradigma\xe2\x80\xa6'",muslimahnews mari saksikan live discussion muslimahnewscom dengan tema permendikbud ppks alat pengokoh paradigma,"['muslimahnews', 'mari', 'saksikan', 'live', 'discussion', 'muslimahnewscom', 'dengan', 'tema', 'permendikbud', 'ppks', 'alat', 'pengokoh', 'paradigma']","['muslimahnews', 'mari', 'saksikan', 'live', 'discussion', 'muslimahnewscom', 'dengan', 'tema', 'permendukbidristek', 'ppks', 'alat', 'pengokoh', 'paradigma']",muslimahnews mari saksikan live discussion muslimahnewscom tema permendukbidristek ppks alat pengokoh paradigma,"['muslimahnews', 'mari', 'saksi', 'live', 'discussion', 'muslimahnewscom', 'tema', 'permendukbidristek', 'ppks', 'alat', 'kokoh', 'paradigma']"
5418,11/20/2021 14:16,1.46206e+18,ilma,"b'RT @muslimahnewscom: MuslimahNews \xe2\x80\x93 Bukankah membiarkan aktivitas seksual yang dilakukan dengan persetujuan dan tanpa pemaksaan, alias zina\xe2\x80\xa6'","b'rt @muslimahnewscom: muslimahnews \xe2\x80\x93 bukankah membiarkan aktivitas seksual yang dilakukan dengan persetujuan dan tanpa pemaksaan, alias zina\xe2\x80\xa6'",muslimahnews bukankah membiarkan aktivitas seksual yang dilakukan dengan persetujuan dan tanpa pemaksaan alias zina,"['muslimahnews', 'bukankah', 'membiarkan', 'aktivitas', 'seksual', 'yang', 'dilakukan', 'dengan', 'persetujuan', 'dan', 'tanpa', 'pemaksaan', 'alias', 'zina']","['muslimahnews', 'bukankah', 'membiarkan', 'aktivitas', 'seksual', 'yang', 'dilakukan', 'dengan', 'persetujuan', 'dan', 'tanpa', 'pemaksaan', 'alias', 'zina']",muslimahnews membiarkan aktivitas seksual persetujuan pemaksaan alias zina,"['muslimahnews', 'biar', 'aktivitas', 'seksual', 'tuju', 'paksa', 'alias', 'zina']"
5422,11/20/2021 13:58,1.46206e+18,ilma,b'RT @muslimahnewscom: MuslimahNews \xe2\x80\x93 Sistem Islam akan menutup celah bagi aktivitas yang mengumbar aurat atau sensualitas di tempat umum. Se\xe2\x80\xa6',b'rt @muslimahnewscom: muslimahnews \xe2\x80\x93 sistem islam akan menutup celah bagi aktivitas yang mengumbar aurat atau sensualitas di tempat umum. se\xe2\x80\xa6',muslimahnews sistem islam akan menutup celah bagi aktivitas yang mengumbar aurat atau sensualitas di tempat umum se,"['muslimahnews', 'sistem', 'islam', 'akan', 'menutup', 'celah', 'bagi', 'aktivitas', 'yang', 'mengumbar', 'aurat', 'atau', 'sensualitas', 'di', 'tempat', 'umum', 'se']","['muslimahnews', 'sistem', 'islam', 'akan', 'menutup', 'celah', 'bagi', 'aktivitas', 'yang', 'mengumbar', 'aurat', 'atau', 'sensualitas', 'di', 'tempat', 'umum', 'se']",muslimahnews sistem islam menutup celah aktivitas mengumbar aurat sensualitas,"['muslimahnews', 'sistem', 'islam', 'tutup', 'celah', 'aktivitas', 'umbar', 'aurat', 'sensualitas']"
4852,11/22/2021 13:50,1.46278e+18,Republika.co.id,b'Nadiem berjanji akan mempertimbangkan masukan dari PBNU. https://t.co/WS262fvtCp',b'nadiem berjanji akan mempertimbangkan masukan dari pbnu. https://t.co/ws262fvtcp',nadiem berjanji akan mempertimbangkan masukan dari pbnu,"['nadiem', 'berjanji', 'akan', 'mempertimbangkan', 'masukan', 'dari', 'pbnu']","['nadiem', 'berjanji', 'akan', 'mempertimbangkan', 'masukan', 'dari', 'pbnu']",nadiem berjanji mempertimbangkan masukan pbnu,"['nadiem', 'janji', 'timbang', 'masuk', 'pbnu']"
2575,11/23/2021 6:06,1.46303e+18,detikcom,b'Nadiem Makarim bertemu Said Aqil untuk membahas polemik Permendikbud tentang PPKS. Ini masukan dari Said Aqil. https://t.co/XdfkoGbbNm',b'nadiem makarim bertemu said aqil untuk membahas polemik permendikbud tentang ppks. ini masukan dari said aqil. https://t.co/xdfkogbbnm',nadiem makarim bertemu said aqil untuk membahas polemik permendikbud tentang ppks ini masukan dari said aqil,"['nadiem', 'makarim', 'bertemu', 'said', 'aqil', 'untuk', 'membahas', 'polemik', 'permendikbud', 'tentang', 'ppks', 'ini', 'masukan', 'dari', 'said', 'aqil']","['nadiem', 'makarim', 'bertemu', 'said', 'aqil', 'untuk', 'membahas', 'polemik', 'permendukbidristek', 'tentang', 'ppks', 'ini', 'masukan', 'dari', 'said', 'aqil']",nadiem makarim bertemu said aqil membahas polemik permendukbidristek ppks masukan said aqil,"['nadiem', 'makarim', 'temu', 'said', 'aqil', 'bahas', 'polemik', 'permendukbidristek', 'ppks', 'masuk', 'said', 'aqil']"
4972,11/22/2021 12:43,1.46276e+18,Popularitas.com,b'Nadiem Makarim minta masukan PBNU revisi Permendikbud PPKS #nadiemmakarim #permedikbudnomor30tahun2021\xe2\x80\xa6 https://t.co/sbEJ1FBOQe',b'nadiem makarim minta masukan pbnu revisi permendikbud ppks #nadiemmakarim #permedikbudnomor30tahun2021\xe2\x80\xa6 https://t.co/sbej1fboqe',nadiem makarim minta masukan pbnu revisi permendikbud ppks,"['nadiem', 'makarim', 'minta', 'masukan', 'pbnu', 'revisi', 'permendikbud', 'ppks']","['nadiem', 'makarim', 'minta', 'masukan', 'pbnu', 'revisi', 'permendukbidristek', 'ppks']",nadiem makarim masukan pbnu revisi permendukbidristek ppks,"['nadiem', 'makarim', 'masuk', 'pbnu', 'revisi', 'permendukbidristek', 'ppks']"
1045,11/24/2021 10:41,1.46346e+18,IDO for Indonesia,"b'Karena ini  juga, Nadiem Makarim (@nadiemmakarim) menerbitkan Permendikbud No 30 Tahun 2021 tentang Pencegahan dan\xe2\x80\xa6 https://t.co/MuADtItuuP'","b'karena ini  juga, nadiem makarim (@nadiemmakarim) menerbitkan permendikbud no 30 tahun 2021 tentang pencegahan dan\xe2\x80\xa6 https://t.co/muadtituup'",karena ini juga nadiem makarim menerbitkan permendikbud no tahun tentang pencegahan dan,"['karena', 'ini', 'juga', 'nadiem', 'makarim', 'menerbitkan', 'permendikbud', 'no', 'tahun', 'tentang', 'pencegahan', 'dan']","['karena', 'ini', 'juga', 'nadiem', 'makarim', 'menerbitkan', 'permendukbidristek', 'no', 'tahun', 'tentang', 'pencegahan', 'dan']",nadiem makarim menerbitkan permendukbidristek no pencegahan,"['nadiem', 'makarim', 'terbit', 'permendukbidristek', 'no', 'cegah']"
5267,11/22/2021 7:25,1.46268e+18,dd⁷,b'RT @mazzini_gsp: Nadiem Makarim bakal menurunkan akreditasi kampus yang tidak menjalankan Permendikbud Ristek nomor 30 tahun 2021 tentang P\xe2\x80\xa6',b'rt @mazzini_gsp: nadiem makarim bakal menurunkan akreditasi kampus yang tidak menjalankan permendikbud ristek nomor 30 tahun 2021 tentang p\xe2\x80\xa6',nadiem makarim bakal menurunkan akreditasi kampus yang tidak menjalankan permendikbud ristek nomor tahun tentang,"['nadiem', 'makarim', 'bakal', 'menurunkan', 'akreditasi', 'kampus', 'yang', 'tidak', 'menjalankan', 'permendikbud', 'ristek', 'nomor', 'tahun', 'tentang']","['nadiem', 'makarim', 'bakal', 'menurunkan', 'akreditasi', 'kampus', 'yang', 'tidak', 'menjalankan', 'permendukbidristek', 'ristek', 'nomor', 'tahun', 'tentang']",nadiem makarim menurunkan akreditasi kampus menjalankan permendukbidristek ristek nomor,"['nadiem', 'makarim', 'turun', 'akreditasi', 'kampus', 'jalan', 'permendukbidristek', 'ristek', 'nomor']"
4674,11/22/2021 14:50,1.4628e+18,BeritaSatu,b'Nadiem Makarim menyambangi PBNU untuk memberi klarifikasi sekaligus meminta masukan soal Permendikbudristek 30/2021\xe2\x80\xa6 https://t.co/r9aPtMv5Md',b'nadiem makarim menyambangi pbnu untuk memberi klarifikasi sekaligus meminta masukan soal permendikbudristek 30/2021\xe2\x80\xa6 https://t.co/r9aptmv5md',nadiem makarim menyambangi pbnu untuk memberi klarifikasi sekaligus meminta masukan soal permendikbudristek,"['nadiem', 'makarim', 'menyambangi', 'pbnu', 'untuk', 'memberi', 'klarifikasi', 'sekaligus', 'meminta', 'masukan', 'soal', 'permendikbudristek']","['nadiem', 'makarim', 'menyambangi', 'pbnu', 'untuk', 'memberi', 'klarifikasi', 'sekaligus', 'meminta', 'masukan', 'soal', 'permendikbudristek']",nadiem makarim menyambangi pbnu klarifikasi masukan permendikbudristek,"['nadiem', 'makarim', 'sambang', 'pbnu', 'klarifikasi', 'masuk', 'permendikbudristek']"
4363,11/22/2021 16:34,1.46282e+18,Sandaljepit,b'RT @Beritasatu: Nadiem Makarim menyambangi PBNU untuk memberi klarifikasi sekaligus meminta masukan soal Permendikbudristek 30/2021\nBaca se\xe2\x80\xa6',b'rt @beritasatu: nadiem makarim menyambangi pbnu untuk memberi klarifikasi sekaligus meminta masukan soal permendikbudristek 30/2021\nbaca se\xe2\x80\xa6',nadiem makarim menyambangi pbnu untuk memberi klarifikasi sekaligus meminta masukan soal permendikbudristek nbaca se,"['nadiem', 'makarim', 'menyambangi', 'pbnu', 'untuk', 'memberi', 'klarifikasi', 'sekaligus', 'meminta', 'masukan', 'soal', 'permendikbudristek', 'nbaca', 'se']","['nadiem', 'makarim', 'menyambangi', 'pbnu', 'untuk', 'memberi', 'klarifikasi', 'sekaligus', 'meminta', 'masukan', 'soal', 'permendikbudristek', 'baca', 'se']",nadiem makarim menyambangi pbnu klarifikasi masukan permendikbudristek baca,"['nadiem', 'makarim', 'sambang', 'pbnu', 'klarifikasi', 'masuk', 'permendikbudristek', 'baca']"
